{
  "repository_type": "global_impact_evidence_repository",
  "repository_version": "1.3.0",
  "workspace_id": "gic-workspace-bdc75d8b68333af2",
  "sources": [
    {
      "source_id": "gic-source-f2284ef9ae098b56",
      "workspace_id": "gic-workspace-bdc75d8b68333af2",
      "initiative_id": "gic-initiative-09a657f60923ed45",
      "title": "Pilot utility-billing sample and participant survey summary",
      "source_type": "entered_source",
      "locator": "Internal pilot evidence package GIC-ENERGY-2026-Q2",
      "creator": "",
      "publisher": "",
      "published_at": null,
      "retrieved_at": null,
      "url": "",
      "doi": "",
      "license": "not_recorded",
      "access_rights": "not_recorded",
      "lifecycle_status": "active",
      "current_version": 1,
      "revision": 1,
      "created_at": "2026-07-17T18:00:00+00:00",
      "updated_at": "2026-07-17T18:47:16.508061+00:00",
      "metadata": {
        "canonical_entity": {
          "created_at": "2026-07-17T18:00:00+00:00",
          "entity_type": "source",
          "id": "gic-source-f2284ef9ae098b56",
          "locator": "Internal pilot evidence package GIC-ENERGY-2026-Q2",
          "source_type": "entered_source",
          "title": "Pilot utility-billing sample and participant survey summary",
          "updated_at": "2026-07-17T18:00:00+00:00"
        }
      }
    }
  ],
  "source_versions": [
    {
      "source_version_id": "gic-source-version-3ade6853b711cd7d424a",
      "source_id": "gic-source-f2284ef9ae098b56",
      "version_number": 1,
      "version_label": "contract-1.1.0",
      "content_hash": "59a74dd239f3e03db14e3f2af0dff882bbc093494964254318b9e389caf616f4",
      "checksum_algorithm": "sha256",
      "checksum_value": "59a74dd239f3e03db14e3f2af0dff882bbc093494964254318b9e389caf616f4",
      "mime_type": "application/vnd.global-impact-catalyst.source+json",
      "size_bytes": 305,
      "captured_at": "2026-07-17T18:47:16.508061+00:00",
      "captured_by": "example-builder",
      "metadata": {
        "record_id": "gic-record-3bb3e632355d26c9"
      }
    }
  ],
  "evidence_items": [
    {
      "evidence_id": "gic-evidence-250758ee21b1a8a4ea1b",
      "source_id": "gic-source-f2284ef9ae098b56",
      "source_version_id": "gic-source-version-3ade6853b711cd7d424a",
      "workspace_id": "gic-workspace-bdc75d8b68333af2",
      "initiative_id": "gic-initiative-09a657f60923ed45",
      "evidence_type": "quotation",
      "title": "Observed reduction excerpt",
      "locator": "Table 2, p. 14",
      "exact_quote": "The average monthly utility bill reduction was 18 USD for participating households.",
      "paraphrase": "",
      "notes": "",
      "page_start": null,
      "page_end": null,
      "character_start": null,
      "character_end": null,
      "captured_at": "2026-07-17T18:47:16.510746+00:00",
      "captured_by": "example-builder",
      "content_hash": "03ae7f01e2191bc8282aaf7836c0f8d7d3f3e71965e90c5298c6379db0ab62c9",
      "archived_at": null,
      "revision": 1,
      "metadata": {}
    }
  ],
  "datasets": [
    {
      "dataset_id": "gic-dataset-49e0259a9233bf75493f",
      "source_id": "gic-source-f2284ef9ae098b56",
      "source_version_id": null,
      "workspace_id": "gic-workspace-bdc75d8b68333af2",
      "initiative_id": "gic-initiative-09a657f60923ed45",
      "title": "Participant billing panel",
      "version": "2026-Q2",
      "description": "De-identified panel underlying the observed value.",
      "landing_page": "",
      "distribution_url": "",
      "license": "restricted-internal",
      "checksum_algorithm": "sha256",
      "checksum_value": "aaaaaaaaaaaaaaaaaaaaaaaaaaaaaaaaaaaaaaaaaaaaaaaaaaaaaaaaaaaaaaaa",
      "schema_fingerprint": "bbbbbbbbbbbbbbbbbbbbbbbbbbbbbbbbbbbbbbbbbbbbbbbbbbbbbbbbbbbbbbbb",
      "temporal_coverage": "2025 baseline through 2026 Q2",
      "spatial_coverage": "Chicago, Illinois",
      "row_count": 420,
      "column_count": 18,
      "created_at": "2026-07-17T18:47:16.511351+00:00",
      "updated_at": "2026-07-17T18:47:16.511351+00:00",
      "metadata": {}
    }
  ],
  "provenance_edges": [
    {
      "edge_id": "gic-edge-195dc6d51c44e588e3cf",
      "workspace_id": "gic-workspace-bdc75d8b68333af2",
      "initiative_id": "gic-initiative-09a657f60923ed45",
      "subject_type": "method",
      "subject_id": "gic-method-dfc0b951aac86076",
      "predicate": "produced",
      "object_type": "baseline",
      "object_id": "gic-baseline-bccde48f17ee3898",
      "process_name": "Before-and-after billing comparison",
      "method_id": "gic-method-dfc0b951aac86076",
      "method_version": "1.0",
      "occurred_at": "2026-07-17T18:00:00+00:00",
      "actor": "example-builder",
      "metadata": {}
    },
    {
      "edge_id": "gic-edge-31c0879786b2bf9f5492",
      "workspace_id": "gic-workspace-bdc75d8b68333af2",
      "initiative_id": "gic-initiative-09a657f60923ed45",
      "subject_type": "source",
      "subject_id": "gic-source-f2284ef9ae098b56",
      "predicate": "informs_claim",
      "object_type": "claim",
      "object_id": "gic-claim-36fcd07621180653",
      "process_name": "claim evidence declaration",
      "method_id": null,
      "method_version": "",
      "occurred_at": "2026-07-17T18:00:00+00:00",
      "actor": "example-builder",
      "metadata": {}
    },
    {
      "edge_id": "gic-edge-67295fbebb6ca41faa34",
      "workspace_id": "gic-workspace-bdc75d8b68333af2",
      "initiative_id": "gic-initiative-09a657f60923ed45",
      "subject_type": "source",
      "subject_id": "gic-source-f2284ef9ae098b56",
      "predicate": "supports",
      "object_type": "observation",
      "object_id": "gic-observation-cca59978f04bb0dd",
      "process_name": "canonical contract materialization",
      "method_id": "gic-method-dfc0b951aac86076",
      "method_version": "1.0",
      "occurred_at": "2026-07-17T18:00:00+00:00",
      "actor": "example-builder",
      "metadata": {}
    },
    {
      "edge_id": "gic-edge-6c4a9ec29883e0b2d1d8",
      "workspace_id": "gic-workspace-bdc75d8b68333af2",
      "initiative_id": "gic-initiative-09a657f60923ed45",
      "subject_type": "target",
      "subject_id": "gic-target-61bc37e9887a3252",
      "predicate": "informs_claim",
      "object_type": "claim",
      "object_id": "gic-claim-36fcd07621180653",
      "process_name": "claim evidence declaration",
      "method_id": null,
      "method_version": "",
      "occurred_at": "2026-07-17T18:00:00+00:00",
      "actor": "example-builder",
      "metadata": {}
    },
    {
      "edge_id": "gic-edge-a7732fbd5db8cb759feb",
      "workspace_id": "gic-workspace-bdc75d8b68333af2",
      "initiative_id": "gic-initiative-09a657f60923ed45",
      "subject_type": "method",
      "subject_id": "gic-method-dfc0b951aac86076",
      "predicate": "informs_claim",
      "object_type": "claim",
      "object_id": "gic-claim-36fcd07621180653",
      "process_name": "claim evidence declaration",
      "method_id": null,
      "method_version": "",
      "occurred_at": "2026-07-17T18:00:00+00:00",
      "actor": "example-builder",
      "metadata": {}
    },
    {
      "edge_id": "gic-edge-c0e7c6007f0c441e87d3",
      "workspace_id": "gic-workspace-bdc75d8b68333af2",
      "initiative_id": "gic-initiative-09a657f60923ed45",
      "subject_type": "method",
      "subject_id": "gic-method-dfc0b951aac86076",
      "predicate": "produced",
      "object_type": "observation",
      "object_id": "gic-observation-cca59978f04bb0dd",
      "process_name": "Before-and-after billing comparison",
      "method_id": "gic-method-dfc0b951aac86076",
      "method_version": "1.0",
      "occurred_at": "2026-07-17T18:00:00+00:00",
      "actor": "example-builder",
      "metadata": {}
    },
    {
      "edge_id": "gic-edge-cd7177c01af6d98a5ca2",
      "workspace_id": "gic-workspace-bdc75d8b68333af2",
      "initiative_id": "gic-initiative-09a657f60923ed45",
      "subject_type": "source",
      "subject_id": "gic-source-f2284ef9ae098b56",
      "predicate": "supports",
      "object_type": "baseline",
      "object_id": "gic-baseline-bccde48f17ee3898",
      "process_name": "canonical contract materialization",
      "method_id": "gic-method-dfc0b951aac86076",
      "method_version": "1.0",
      "occurred_at": "2026-07-17T18:00:00+00:00",
      "actor": "example-builder",
      "metadata": {}
    },
    {
      "edge_id": "gic-edge-cefe4a6999cf48868cae",
      "workspace_id": "gic-workspace-bdc75d8b68333af2",
      "initiative_id": "gic-initiative-09a657f60923ed45",
      "subject_type": "observation",
      "subject_id": "gic-observation-cca59978f04bb0dd",
      "predicate": "informs_claim",
      "object_type": "claim",
      "object_id": "gic-claim-36fcd07621180653",
      "process_name": "claim evidence declaration",
      "method_id": null,
      "method_version": "",
      "occurred_at": "2026-07-17T18:00:00+00:00",
      "actor": "example-builder",
      "metadata": {}
    },
    {
      "edge_id": "gic-edge-e61b036495d45d3adc42",
      "workspace_id": "gic-workspace-bdc75d8b68333af2",
      "initiative_id": "gic-initiative-09a657f60923ed45",
      "subject_type": "baseline",
      "subject_id": "gic-baseline-bccde48f17ee3898",
      "predicate": "informs_claim",
      "object_type": "claim",
      "object_id": "gic-claim-36fcd07621180653",
      "process_name": "claim evidence declaration",
      "method_id": null,
      "method_version": "",
      "occurred_at": "2026-07-17T18:00:00+00:00",
      "actor": "example-builder",
      "metadata": {}
    }
  ],
  "claim_evidence_links": [
    {
      "claim_id": "gic-claim-36fcd07621180653",
      "evidence_id": "gic-evidence-250758ee21b1a8a4ea1b",
      "relationship": "supports",
      "strength": "direct",
      "notes": "",
      "linked_at": "2026-07-17T18:47:16.517002+00:00",
      "linked_by": "example-builder"
    }
  ]
}
